{
  "version": 1,
  "updated_at": null,
  "currency": "USD",
  "usd_is_estimate": true,
  "project": {
    "input_tokens": 0,
    "output_tokens": 0,
    "cache_read_tokens": 0,
    "cache_write_tokens": 0,
    "turns": 0,
    "usd_estimate": null
  },
  "by_artifact": {},
  "unattributed": {
    "input_tokens": 0,
    "output_tokens": 0,
    "cache_read_tokens": 0,
    "cache_write_tokens": 0,
    "turns": 0,
    "usd_estimate": null
  },
  "by_process": {}
}
